id;texto;rotulo;fonte
413;José Sérgio Gabrielli encomendou reportagem à Folha de S.Paulo;FALSO;AGÊNCIA LUPA
414;Urnas estavam preenchidas com voto para o Haddad com pelo menos 81%;FALSO;AGÊNCIA LUPA
415;Quadrilha tenta sacar cheque de R$ 68 milhões para Haddad na Bahia;FALSO;AGÊNCIA LUPA
416;Carlos Vereza afirma: ‘O PT não é um partido. É uma organização criminosa. Aparelharam os poderes do país. Aparelharam os poderes do país’;VERDADE;AGÊNCIA LUPA
417;Eu, dentro do hospital, baixado, de cama, cresci muito mais do que ele Haddad nas ruas;FALSO;AGÊNCIA LUPA
418;Ele Haddad e sua coligação tiveram mais de R$ 500 milhões para a campanha;FALSO;AGÊNCIA LUPA
419;Para nós, coube apenas R$ 3 milhões, e eu não usei a parte desse fundo partidário - Jair Bolsonaro (PSL);VERDADE;AGÊNCIA LUPA
420;A Inglaterra, há 20 e poucos anos atrás, diminuiu a sua carga tributária - Jair Bolsonaro (PSL);FALSO;AGÊNCIA LUPA
421;A Assembleia Legislativa do Ceará me concedeu um título de Cidadão Cearense - Fernando Haddad (PT);VERDADE;AGÊNCIA LUPA
422;Foto de Dilma e Fidel em Cuba;FALSO;AGÊNCIA LUPA
423;O Brasil tem 22 hidrelétricas, das quais 20 foram construídas durante o regime militar;FALSO;AGÊNCIA LUPA
424;O outro lado que está disputando comigo Haddad diz, em seu próprio plano de governo, diz que vai exercer controle social da mídia;FALSO;AGÊNCIA LUPA
425;O plano de governo de Haddad propõe Criar mais estatais;FALSO;AGÊNCIA LUPA
426;Eles PT tentaram também censurá-la a internet, via Marco Civil da internet;FALSO;AGÊNCIA LUPA
427;Não temos qualquer comprovação de que são médicos os cubanos que fazem parte do programa Mais Médicos;FALSO;AGÊNCIA LUPA
428;No referendo de 2005, o povo decidiu que quer ter o direito de comprar armas e munições;VERDADE;AGÊNCIA LUPA
429;Trabalharemos pela Redução da nossa maioridade penal, que é o povo quer e deseja - Jair Bolsonaro (PSL);VERDADE;AGÊNCIA LUPA
430;O voto eletrônico É um sistema eleitoral que não existe em nenhum lugar do mundo - Jair Bolsonaro (PSL);FALSO;AGÊNCIA LUPA
431;Me achem um áudio, uma imagem minha dizendo que mulher tem que ganhar menos do que homem. Não existe - Jair Bolsonaro (PSL);FALSO;AGÊNCIA LUPA
432;No referendo de 2005, o Brasil foi desarmado;FALSO;AGÊNCIA LUPA
433;Bolsonaro propôs cortar o 13º salário;FALSO;AGÊNCIA LUPA
434;Eu, praticamente, tripliquei o número de universitários no Brasil - Fernando Haddad (PT);FALSO;AGÊNCIA LUPA
435;Não existe nenhum lugar do mundo que tenha aplicado essa medida teto de gastos - Fernando Haddad (PT);FALSO;AGÊNCIA LUPA
436;Mourão também propõe confisco da poupança;FALSO;AGÊNCIA LUPA
437;Fernando Haddad Sequer conseguiu passar para o 2º turno em São Paulo;VERDADE;AGÊNCIA LUPA
438;Ele mesmo Palocci diz: ‘nas últimas campanhas, Dilma Rousseff gastou em torno de R$ 1,5 bilhão;VERDADE;AGÊNCIA LUPA
439;Eu não estou coligado com ninguém - Jair Bolsonaro (PSL);FALSO;AGÊNCIA LUPA
440;Tem uma passagem falsa dele Adélio Bispo de Oliveira, agressor de Bolsonaro pela Câmara dos Deputados no dia 6 de setembro;FALSO;AGÊNCIA LUPA
441;No governo do PT, umas 50 empresas estatais foram criadas - Jair Bolsonaro (PSL);VERDADE;AGÊNCIA LUPA
442;Temos até a estatal do trem-bala - Jair Bolsonaro (PSL);VERDADE;AGÊNCIA LUPA
443;Quem criou a CPMF foi o Fernando Henrique Cardoso - Jair Bolsonaro (PSL);VERDADE;AGÊNCIA LUPA
444;O próprio José Dirceu acabou de declarar que ganhar eleição é uma coisa, assumir o poder é outra - Jair Bolsonaro (PSL);VERDADE;AGÊNCIA LUPA
445;Ao completar 5 anos de idade, a criança passa a ser propriedade do Estado! Cabe a nós decidir se menino será menina e vice-versa! Aos pais cabe acatar nossa decisão respeitosamente! Sabemos o que é melhor para as crianças! - Fernando Haddad (PT);FALSO;AGÊNCIA LUPA
446;A ONU disse que o pleito apresentado por Lula à entidade era legítimo, em razão da fragilidade da acusação contra ele - Fernando Haddad (PT);FALSO;AGÊNCIA LUPA
447;Cinco bancos, inclusive dois públicos, concentram mais de 80% do crédito - Fernando Haddad (PT);VERDADE;AGÊNCIA LUPA
448;Tasso Jereissati falou: ‘nós cometemos três erros: questionamos o resultado eleitoral. Aprovamos uma pauta em que nós não acreditávamos para prejudicar o PT. Embarcamos no governo Temer;VERDADE;AGÊNCIA LUPA
449;Jovem se esfaqueia para provar que facada de Bolsonaro foi falsa e acaba morrendo;FALSO;AGÊNCIA LUPA
450;Na época das eleições de 2016, o PT estava sozinho, na berlinda, enquanto todas as delações relativas ao PSDB, PP, PMDB estavam represadas - Fernando Haddad (PT);FALSO;AGÊNCIA LUPA
451;No dia do anúncio do resultado das eleições presidenciais de 2014 já havia contestação do resultado - Fernando Haddad (PT);FALSO;AGÊNCIA LUPA
452;Ao estourar a âncora cambial, FHC Provocou um rombo nas contas externas monumental - Fernando Haddad (PT);VERDADE;AGÊNCIA LUPA
453;O suspeito de esfaquear de Bolsonaro seria José Adélio Bispo de Oliveira, filiado ao PDT mineiro;FALSO;AGÊNCIA LUPA
454;Foto mostra o candidato que sofreu uma tentativa de homicídio entrando a pé no hospital;FALSO;AGÊNCIA LUPA
455;Adélio Bispo de Oliveira é o nome de quem tentou matar Jair Bolsonaro em Juiz de Fora. Ele é filiado ao Partido dos Trabalhadores;FALSO;AGÊNCIA LUPA
456;O criminoso que tentou matar Bolsonaro assessora a campanha de Dilma ao senado em Minas;FALSO;AGÊNCIA LUPA
457;Nós do Exército Brasileiro perdemos três jovens garotos para o crime agora - Jair Bolsonaro (PSL);VERDADE;AGÊNCIA LUPA
458;Não se consegue produzir um prego no Brasil e colocar de forma competitiva no Paraguai - Jair Bolsonaro (PSL);FALSO;AGÊNCIA LUPA
459;Nas últimas eleições para prefeito, o Datafolha último errou em 60 e tantos porcento - Jair Bolsonaro (PSL);FALSO;AGÊNCIA LUPA
460;O senhor Henrique Meirelles foi presidente do Banco Central por oito anos, depois foi para a JBS/Friboi - Jair Bolsonaro (PSL);VERDADE;AGÊNCIA LUPA
